{"params_version": 2, "abstract": "lmcache_shared_fs",
 "doc": "The values lmcache_shared_fs's defaults held until 2026-10-23 (DESIGN_REVIEW.md \u00a73.78): an engine with 64 request slots, 2,000 requests per slot to warm and 20,000 measured, 32 MiB chunks (128 KiB per token, an 8B model's), a context of 8,192, 40 conversations open per slot, 50 system prompts of a median 1,500 tokens, ShareGPT's turn lengths, and a pool that keeps nothing of 91% of returning conversations. Placeholders, not measured: no job stands behind them (the traces behind the abstract are the example sharegpt-chat). The same values in both files: the reader is run with the writer's parameters.",
 "params": {
  "chunk_bytes": {"default": 33554432},
  "context": {"default": 8192},
  "prefill_per_token": {"default": 40000},
  "decode_per_token": {"default": 12000000},
  "keep": {"default": {"empirical": {"values": [0, 1000000], "weights": [91, 9]}}},
  "prefill_step": {"default": 8192},
  "retain": {"default": 5000},
  "concurrency": {"default": 64},
  "requests": {"default": 20000},
  "warm": {"default": 2000},
  "reuse": {"default": {"mixture": [{"weight": 0.15, "dist": null}, {"weight": 0.85, "dist": {"const": 40}}]}},
  "turn_in": {"default": {"empirical": {"values": [1, 4, 6, 7, 9, 10, 11, 13, 15, 17, 19, 22, 26, 31, 39, 50, 68, 107, 214, 944], "weights": [1, 1, 1, 1, 1, 1, 1, 1, 1, 1, 1, 1, 1, 1, 1, 1, 1, 1, 1, 1]}}},
  "turn_out": {"default": {"empirical": {"values": [12, 34, 62, 92, 119, 148, 175, 201, 225, 248, 271, 294, 317, 342, 370, 407, 454, 519, 615, 785], "weights": [1, 1, 1, 1, 1, 1, 1, 1, 1, 1, 1, 1, 1, 1, 1, 1, 1, 1, 1, 1]}}},
  "sys_prompts": {"default": 50},
  "sys_tokens": {"default": 1500},
  "sys_pop": {"default": {"zipf": {"s": 1.1}}}}}
