{
  "params_version": 2,
  "abstract": "safetensors_load",
  "doc": "The tensor table of a two-layer Llama-shaped model (hidden 64, intermediate 128, vocab 256, F16) in two shards, made by `aeiou-params safetensors` from synthetic shards with real headers (builder/tests/test_params.py::make_synthetic_model). An example of the mechanism, not a reference set: a real model's set is made the same way from its shards.",
  "params": {
    "shards": {"default": 2},
    "shard_bytes": {"default": 103896},
    "hdr_len": {"default": [
      1032,
      1104
    ]},
    "tp": {"default": 8},
    "shard": {"default": [
      0,
      0,
      0,
      0,
      0,
      0,
      0,
      0,
      0,
      0,
      1,
      1,
      1,
      1,
      1,
      1,
      1,
      1,
      1,
      1,
      1
    ]},
    "off": {"default": [
      1040,
      33808,
      33936,
      50320,
      66704,
      83088,
      83216,
      85264,
      93456,
      101648,
      1112,
      33880,
      34008,
      50392,
      66776,
      83160,
      83288,
      85336,
      93528,
      101720,
      103768
    ]},
    "bytes": {"default": [
      32768,
      128,
      16384,
      16384,
      16384,
      128,
      2048,
      8192,
      8192,
      2048,
      32768,
      128,
      16384,
      16384,
      16384,
      128,
      2048,
      8192,
      8192,
      2048,
      128
    ]},
    "split": {"default": [
      "column",
      "full",
      "row",
      "column",
      "column",
      "full",
      "column",
      "row",
      "column",
      "column",
      "column",
      "full",
      "row",
      "column",
      "column",
      "full",
      "column",
      "row",
      "column",
      "column",
      "full"
    ]},
    "rows": {"default": [
      1,
      1,
      64,
      1,
      1,
      1,
      1,
      64,
      1,
      1,
      1,
      1,
      64,
      1,
      1,
      1,
      1,
      64,
      1,
      1,
      1
    ]},
    "row_bytes": {"default": [
      32768,
      128,
      256,
      16384,
      16384,
      128,
      2048,
      128,
      8192,
      2048,
      32768,
      128,
      256,
      16384,
      16384,
      128,
      2048,
      128,
      8192,
      2048,
      128
    ]}
  },
  "provenance": {
    "tool": "aeiou-params 0.1.0",
    "command": "safetensors",
    "ast_sha256": "5fa90c2b77e53c07b11c93b37dc29f3544cbe3e3974b063a25222c2b35fcaa5f",
    "shards": [
      {
        "file": "model-00001-of-00002.safetensors",
        "sha256": "abf1ad1a51707216963681ceac3e24488f0d5ca220f0c02b8ce3261a89f3b571"
      },
      {
        "file": "model-00002-of-00002.safetensors",
        "sha256": "331be4dea23fba7c18c1e4cbef7de91c4b2c61228ccdd3ae6f2f86df16fceb03"
      }
    ],
    "column": "(q_proj|k_proj|v_proj|gate_proj|up_proj|embed_tokens|lm_head)\\.weight$",
    "row": "(o_proj|down_proj)\\.weight$"
  }
}
