{"params_version": 2, "abstract": "tfrecord_stream",
 "doc": "The values tfrecord_stream's defaults held until 2026-10-22 (DESIGN_REVIEW.md §3.78): 1,281,167 samples, ImageNet-1k's training count, of a median 110 KiB, as records, 1,024 to a shard; batch 256, 4 shards interleaved each 1 ahead, 500 steps of 105 ms, no decode compute. Placeholders, not measured, and untraced: no application run stands behind them.",
 "params": {"batch": {"default": 256}, "samples_per_file": {"default": 1024}, "cycle": {"default": 4}, "prefetch": {"default": 1}, "steps": {"default": 500}, "step_time": {"default": 105000000}, "decode": {"default": 0}, "samples": {"default": 1281167}, "sample_median": {"default": 112640}}}
