{"params_version": 2, "abstract": "lmcache_local_disk",
 "doc": "Fitted by agentx.py to traces.jsonl (8 sessions): 219 requests in 45 chains; 1.1% of continuing requests cut their chain (trim) and the chain grows by 101% of the corpus's prompt growth (the reply counted whole where the model kept less of it); sys_tokens the main agent's prefix (the prefix its cuts most often keep), sub_tokens the median prefix a sub-agent's first prompt shares with its session, kind the chains' first prompts by the prefix they open with; the requests replay_agentx.py sent (8 sessions as 8 slots, 27 requests each, back to back), and keep from the server's log: of 174 continuing requests the engine held the whole kept prefix in 1.",
 "params": {
  "concurrency": {"default": 8},
  "warm": {"default": 0},
  "requests": {"default": 27},
  "chunk_tokens": {"default": 256},
  "context": {"default": 131072},
  "sys_prompts": {"default": 1},
  "sys_tokens": {"default": 32704},
  "sys_tokens_min": {"default": 32704},
  "sys_tokens_max": {"default": 32704},
  "sys_local": {"default": false},
  "sub_prompts": {"default": 1},
  "sub_tokens": {"default": 25600},
  "sub_tokens_min": {"default": 25600},
  "sub_tokens_max": {"default": 25600},
  "kind": {"default": {"empirical": {"values": [0, 1, 2], "weights": [8, 10, 27]}}},
  "reuse": {"default": {"mixture": [{"weight": 0, "dist": null}, {"weight": 1, "dist": {"const": 1}}]}},
  "turns": {"default": {"empirical": {"values": [1, 1, 1, 1, 1, 1, 1, 1, 1, 1, 1, 1, 1, 1, 1, 1, 1, 1, 1, 1, 1, 1, 2, 2, 2, 2, 2, 3, 3, 4, 5, 5, 5, 6, 6, 6, 8, 9, 11, 12, 13, 14, 19, 28, 30], "weights": [1, 1, 1, 1, 1, 1, 1, 1, 1, 1, 1, 1, 1, 1, 1, 1, 1, 1, 1, 1, 1, 1, 1, 1, 1, 1, 1, 1, 1, 1, 1, 1, 1, 1, 1, 1, 1, 1, 1, 1, 1, 1, 1, 1, 1]}}},
  "retain": {"default": 219},
  "turn_in": {"default": {"empirical": {"values": [0, 0, 37, 113, 253, 362, 557, 758, 943, 1140, 1412, 1770, 2568, 3862, 5687, 7064, 10124, 13914, 21901, 32746], "weights": [1, 1, 1, 1, 1, 1, 1, 1, 1, 1, 1, 1, 1, 1, 1, 1, 1, 1, 1, 1]}}},
  "first_in": {"default": {"empirical": {"values": [192, 416, 491, 640, 640, 704, 704, 1856, 2944, 2944, 2944, 2944, 2976, 3968, 8032, 11072, 16000, 24192, 31467, 43840], "weights": [1, 1, 1, 1, 1, 1, 1, 1, 1, 1, 1, 1, 1, 1, 1, 1, 1, 1, 1, 1]}}},
  "turn_out": {"default": {"empirical": {"values": [34, 87, 103, 125, 160, 194, 249, 297, 359, 402, 474, 546, 617, 723, 815, 1067, 1553, 2195, 2989, 5140], "weights": [1, 1, 1, 1, 1, 1, 1, 1, 1, 1, 1, 1, 1, 1, 1, 1, 1, 1, 1, 1]}}},
  "think": {"default": {"const": 0}},
  "trim": {"default": {"mixture": [{"weight": 0.9885, "dist": {"const": 0}}, {"weight": 0.0115, "dist": {"empirical": {"values": [282, 26148], "weights": [1, 1]}}}]}},
  "keep": {"default": {"empirical": {"values": [0, 0, 0, 0, 0, 0, 0, 35, 192, 192, 192, 192, 192, 192, 192, 192, 192, 4059, 7276, 16576], "weights": [1, 1, 1, 1, 1, 1, 1, 1, 1, 1, 1, 1, 1, 1, 1, 1, 1, 1, 1, 1]}}},
  "sys_held": {"default": {"empirical": {"values": [122, 10307, 18864, 32704, 32704, 32704, 32704, 32704, 32704, 32704, 32704, 32704, 32704, 32704, 32704, 32704, 32704, 32704, 32704, 32704], "weights": [1, 1, 1, 1, 1, 1, 1, 1, 1, 1, 1, 1, 1, 1, 1, 1, 1, 1, 1, 1]}}},
  "sub_held": {"default": {"empirical": {"values": [0, 0, 0, 6784, 6784, 6784, 6784, 6784, 6784, 16597, 16640, 16640, 16640, 18795, 24832, 24832, 24832, 24832, 24832, 24832], "weights": [1, 1, 1, 1, 1, 1, 1, 1, 1, 1, 1, 1, 1, 1, 1, 1, 1, 1, 1, 1]}}},
  "chunk_bytes": {"default": 3145728},
  "prefill_step": {"default": 2048}},
 "provenance": {"conditions": {"model": "Qwen/Qwen2.5-0.5B-Instruct", "max_model_len": 131072, "kv_cache_memory_bytes": 2147483648, "engine_pool_tokens": 174752, "cpu_tier_bytes": 0, "slots_per_engine": 8, "latency_s_per_prompt_token": 0.000659, "latency_s_per_reply_token": 0.0326}}}
