{"params_version": 2, "abstract": "faiss_ivf_ondisk", "doc": "Fitted to the 2026-10-01 trace of IndexIVFPQ.search over OnDiskInvertedLists: SIFT1M, IVF1024,PQ32, nprobe 64, 20 calls of one query, one OpenMP thread.", "params": {"threads": {"default": 1}, "calls": {"default": 20}, "batch": {"default": 1}, "nprobe": {"default": 64}, "lists": {"default": 1024}, "code_size": {"default": 32}, "list_bytes": {"default": {"lognormal": {"median": 36247, "sigma": 0.39, "min": 2720, "max": 175960}}}, "list_pop": {"default": {"zipf": {"s": 0.2}}}, "index_bytes": {"default": 680212}, "index_reads": {"default": [8192, 516096, 8192, 122880, 8192, 16384, 8192]}, "distance": {"default": 400000}}}
