{"params_version": 2, "abstract": "file_per_sample",
 "doc": "Fitted to the 2026-10-01 trace of DataLoader + ImageFolder: 3200 JPEGs, batch 16, 2 workers, 2 epochs.",
 "params": {"batch": {"default": 16}, "workers": {"default": 2}, "prefetch": {"default": 2}, "steps": {"default": 400}, "samples": {"default": 3200}, "walk": {"default": true}}}
