{"params_version": 2, "abstract": "npy_per_sample",
 "doc": "Unet3D on a B200: batch 7 and 162 ms of compute per step, the WG's reference values (its DLIO config unet3d_b200.yaml: batch_size, computation_time); the WG took the step time as H100's 323 ms halved, not measured.",
 "params": {"batch": {"default": 7}, "step_time": {"default": 162000000}}}
