{"params_version": 2, "abstract": "diskann_search", "doc": "Fitted to the 2026-10-02 trace of DiskANN PQFlashIndex (diskannpy 0.7.0): SIFT1M, degree 64, search list 100, beam 4, no node cache, 1,000 queries over 2 threads. Its CPU is 0.5 ms a query, the user time measured on the traces (0.46 to 0.62 ms; DESIGN_REVIEW.md §3.50), not fitted per case.", "params": {"threads": {"default": 2}, "queries": {"default": 500}, "beam": {"default": 4}, "hops": {"default": {"empirical": {"values": [24, 25, 26, 27, 28, 29, 30], "weights": [1, 135, 536, 270, 47, 9, 2]}}}, "entry": {"default": {"hotset": {"fraction": 6.249968750156249e-05, "weight": 1.0}}}, "near": {"default": {"hotset": {"fraction": 0.003302483487582562, "weight": 1.0}}}, "node_cache": {"default": 0}, "rerank": {"default": 500000}, "n": {"default": 1000000}, "dim": {"default": 128}, "degree": {"default": 64}, "pq_code": {"default": 32}}}
