{"params_version": 2, "abstract": "dcp_load", "doc": "Fitted to the 2026-10-01 trace of torch.distributed.checkpoint.load on 2 ranks: the 6 items dcp_save's kit wrote (the last one small).", "params": {"items": {"default": 6}, "item_bytes": {"default": [16777216, 33554432, 16777216, 8388608, 524288, 2096]}, "item_off": {"default": [0, 16778793, 50334802, 67113595, 75503780, 76029645]}, "read_order": {"default": [0, 1, 2, 3, 4, 5]}, "meta_bytes": {"default": 2606}, "restore_step": {"default": 100}}}
